[{"businessRequirements":[{"en":"Dummy business requirement","ja":"ダミーのビジネス要件"}],"existingEnvironment":{"en":"Dummy existing environment","ja":"ダミーの既存環境"},"id":"altostrat","name":{"en":"Dummy case altostrat","ja":"ダミーケース altostrat"},"officialURL":"https://cloud.google.com/learn/certification/cloud-architect","requirementMappings":[{"rationale":{"en":"Dummy rationale","ja":"ダミーの理由"},"recommendedServices":["Cloud Run"],"rejectedOptions":[{"reason":{"en":"Dummy reason","ja":"ダミーの不採用理由"},"service":"Compute Engine"}],"requirement":{"en":"Dummy requirement","ja":"ダミーの要件"}}],"summary":{"en":"Dummy summary","ja":"ダミーの概要"},"technicalRequirements":[{"en":"Dummy technical requirement","ja":"ダミーの技術要件"}]},{"businessRequirements":[{"en":"Dummy business requirement","ja":"ダミーのビジネス要件"}],"existingEnvironment":{"en":"Dummy existing environment","ja":"ダミーの既存環境"},"id":"ehr","name":{"en":"Dummy case ehr","ja":"ダミーケース ehr"},"officialURL":"https://cloud.google.com/learn/certification/cloud-architect","requirementMappings":[{"rationale":{"en":"Dummy rationale","ja":"ダミーの理由"},"recommendedServices":["Cloud Run"],"rejectedOptions":[{"reason":{"en":"Dummy reason","ja":"ダミーの不採用理由"},"service":"Compute Engine"}],"requirement":{"en":"Dummy requirement","ja":"ダミーの要件"}}],"summary":{"en":"Dummy summary","ja":"ダミーの概要"},"technicalRequirements":[{"en":"Dummy technical requirement","ja":"ダミーの技術要件"}]}]